{
  "id": "cog-san-francisco-powell-hallidie-elevator",
  "title": "Routing correction: Hallidie Plaza elevator is covered by a Public Works project",
  "summary": "SFMTA's current elevator status feed listed the Hallidie Plaza street elevator at Powell Station as out of service on 2026-08-27. A later ownership and project check found that SFMTA itself places the non-functional elevator in DPW jurisdiction and that Public Works already has an accessibility project for permanent removal and replacement ramps. This card is discarded as a new repair candidate and preserves the routing error.",
  "status": "discarded",
  "problem_type": "accessibility",
  "jurisdiction": {
    "country_code": "US",
    "region": "California",
    "city": "San Francisco",
    "location_label": "Powell Station, Hallidie Plaza street elevator",
    "location_precision": "public_facility"
  },
  "evidence": [
    {
      "source_url": "https://www.sfmta.com/elevator-status/elevatorstatus.php?src=prod",
      "source_type": "service_status",
      "source_updated_at": "2026-08-27T16:58:00Z",
      "accessed_at": "2026-08-27T17:05:56Z",
      "supports": "The official SFMTA status feed was valid as of 9:58 AM local time and listed Powell Station's Hallidie Plaza - Street Elevator as Out of service. The same feed listed other Powell elevators in service.",
      "reliability": 0.95
    },
    {
      "source_url": "https://www.sfmta.com/travel-updates/muni-metro-elevator-status",
      "source_type": "official_service_page",
      "accessed_at": "2026-08-27T17:02:41Z",
      "supports": "The official SFMTA page describes the elevator status page as current at page load and directs people to a Station Agent or 311 when an elevator is out of service.",
      "reliability": 0.9
    },
    {
      "source_url": "https://www.sfmta.com/accessibility-strategy-needs-assessment-2024/muni-capital-projects/32-reliable-elevators-and-escalators",
      "source_type": "official_service_page",
      "source_updated_at": "2026-04-11T03:13:50Z",
      "accessed_at": "2026-08-27T17:19:29Z",
      "supports": "SFMTA's accessibility strategy says the Hallidie Plaza elevator between Market Street and the concourse is not functional and is in DPW jurisdiction.",
      "reliability": 0.98
    },
    {
      "source_url": "https://sfpublicworks.org/HallidiePlaza",
      "source_type": "official_service_page",
      "accessed_at": "2026-08-27T17:19:29Z",
      "supports": "The official Public Works project page says the decommissioned Market Street elevator will be permanently removed and replaced by accessible ramps. It gives a construction timeline of Summer 2027 through Spring 2028 and names San Francisco Public Works on the project team.",
      "reliability": 0.98
    },
    {
      "source_url": "https://data.sfgov.org/resource/vw6y-z8j6.json?%24select=count%28%2A%29%20as%20count&%24where=service_name%3D%27Muni%20Service%20Feedback%27%20and%20service_details%3D%27elevators_escalators%27%20and%20requested_datetime%20%3E%3D%20%272026-05-29T00%3A00%3A00%27%20and%20%28upper%28address%29%20like%20%27%25POWELL%25%27%20or%20upper%28address%29%20like%20%27%25HALLIDIE%25%27%29",
      "source_type": "official_record",
      "source_updated_at": "2026-08-27T10:17:05Z",
      "accessed_at": "2026-08-27T17:06:24Z",
      "supports": "The public SF 311 query returned count 0 for elevator cases at Powell or Hallidie opened from 2026-05-29 through the check time. This is a public-window duplicate check, not proof that no internal SFMTA case exists.",
      "reliability": 0.85
    },
    {
      "source_url": "https://data.sfgov.org/resource/vw6y-z8j6.json?%24select=service_request_id%2Crequested_datetime%2Cupdated_datetime%2Cstatus_description%2Caddress&%24where=service_name%3D%27Muni%20Service%20Feedback%27%20and%20service_details%3D%27elevators_escalators%27%20and%20%28upper%28address%29%20like%20%27%25POWELL%25%27%20or%20upper%28address%29%20like%20%27%25HALLIDIE%25%27%29&%24order=requested_datetime%20desc&%24limit=10",
      "source_type": "official_record",
      "accessed_at": "2026-08-27T17:02:41Z",
      "supports": "The wider historical query found five Powell-related elevator records. All were closed. The newest was opened on 2025-10-15 and last updated on 2025-10-16.",
      "reliability": 0.85
    }
  ],
  "responsible_service": {
    "name": "San Francisco Public Works Hallidie Plaza Accessibility Improvements project",
    "basis": "SFMTA's accessibility strategy explicitly places the non-functional Hallidie Plaza elevator in DPW jurisdiction. The official Public Works project page covers permanent removal of the decommissioned elevator and construction of accessible ramps.",
    "official_url": "https://sfpublicworks.org/HallidiePlaza",
    "contact_method": "Existing Public Works project page",
    "confidence": 0.98
  },
  "stop_reason": {
    "category": "other",
    "reason": "The underlying accessibility problem is covered by an existing Public Works project. The elevator is described as decommissioned and scheduled for permanent removal with replacement ramps, so a new repair request to SFMTA would be misrouted and duplicative. This run records the routing error and prepares no external action."
  },
  "privacy": {
    "contains_personal_data": false,
    "redaction_reviewed": true,
    "redaction_notes": "Only a public transit station and public facility label are included. No person, private address, contact detail, photo, token, or case identifier is included."
  },
  "audit": {
    "created_at": "2026-08-27T17:02:41Z",
    "updated_at": "2026-08-27T17:19:29Z",
    "checks": [
      "Official SFMTA live status endpoint returned HTTP 200",
      "The status feed was valid as of 2026-08-27 09:58 AM Pacific time",
      "Hallidie Plaza street elevator was listed Out of service",
      "The bounded public SF 311 duplicate query returned count 0",
      "Historical matching public records were closed and retained as context",
      "SFMTA's accessibility strategy placed the non-functional elevator in DPW jurisdiction",
      "Public Works project coverage and decommissioned status were checked",
      "The previous SFMTA routing was recorded as an error",
      "The card was stopped without preparing an external action",
      "No write endpoint or feedback form was called"
    ]
  }
}
